"title","price","isDisponible","category"
"TDAH : Pourquoi être ordinaire quand on peut être spécial ?","16000 CFA","Disponible","Développement personnel,motivation et inspiration,Psychologie et bien être"
"Textes clés de philosophie féministe Poche, Manon Garcia","20000 CFA","","Sans catégorie"
"Ton talent, Ton ADN AM Augustin Mirimo","12000 CFA","Disponible","Développement personnel"
"Tout est possible !: Créez la vie et le job de vos rêves, Marie Forleo","13000 CFA","Disponible","Développement personnel"
"Tout le monde n’a pas eu la chance de rater ses études Olivier Roland","20600 CFA","Disponible","Entrepreneuriat"
"Traction – Comment toute start-up peut développer rapidement sa clientèle, Gabriel Weinberg","20000 CFA","Disponible","Marketing de réseau,Marketing et vente"
"Travail d’équipe 101 John C.Maxwell","9000 CFA","Disponible","JOHN C. MAXWELL"
"Trouver son pourquoi – Simon Sinek","6000 CFA","Disponible","Nouveaux Horizons"
"Tu veux un changement? Fais-le toi-même, Elisée KOUASSI","5000 CFA","Disponible","Entrepreneuriat,motivation et inspiration"
"Un an pour gagner un million – Comment trouver le produit gagnant et développer une entreprise prospère Ryan Daniel Moran","16000 CFA","Disponible","Business et entrepreneuriat"
"Un marché de plusieurs millions à votre portée! comment arriver à se moquer des ennuis d’argent","3500 CFA","Disponible","Business et entrepreneuriat,Entrepreneuriat"
"Un mentor en or – 1001 conseils de millionnaire pour une vie accomplie Kevin Harrington, Marc Timm","16000 CFA","Disponible","Entrepreneuriat"
"Un rien peut tout changer, James Clear","7000 CFA","Disponible","Développement personnel,Nouveaux Horizons"
"Une performance digne d’un rappel – Comment exceller dans tout ce que l’on fait, Mark Sanborn","10000 CFA","Disponible","Déstockage,Développement personnel"
"une seconde chance pour votre argent, votre vie et notre monde – Robert Kiyosaki","18000 CFA","Disponible","Développement personnel"
"Vaincre les attaques sataniques dans les rêves FN Francis Ngawala","12000 CFA","Disponible","Sans catégorie"
"Vivant 99 outils pour s’écouter, se retrouver et aller de l’avant","10500 CFA","Disponible","Développement personnel,motivation et inspiration"
"VIVRE AVEC PASSION,  Florent Tanlet","14000 CFA","Disponible","Développement personnel"
"Vivre grand : Développez votre confiance jusqu’à l’audace !","10000 CFA","Disponible","Développement personnel"
"Vivre intentionnellement- choisir une vie qui compte – John Maxwell","15000 CFA","Disponible","JOHN C. MAXWELL,Leadership et Management"
"votre droit absolu à la richesse joseph murphy- Adhérez aux lois fondamentales de l’esprit","12500 CFA","Disponible","Développement personnel"
"Votre passion, un meilleur domaine d’affaire,  EKF Etienne Katanku Fortunatus","15000 CFA","Disponible","Développement personnel"
"Vous l’avez rêvé alors vivez le – John Maxwell","11000 CFA","Disponible","Développement personnel,JOHN C. MAXWELL,Leadership et Management"
"Voyages à l’intérieur de soi","18000 CFA","Disponible","Développement personnel,motivation et inspiration"
"Warren Buffett. La biographie officielle, l’effet boule de neige","26700 CFA","Disponible","Biographies"